{
  "chquery": 1,
  "created_at": "2026-09-03T12:00:00Z",
  "source": { "kind": "agent-skill", "tool": "test agent", "skill_version": "1.0.0" },
  "clickhouse": { "version": "25.8.3.1", "cloud_mode": 0, "cloud": false },
  "sql": "SELECT login FROM default.actors WHERE followers > <num_1>",
  "explain": {
    "plan": [
      {
        "Plan": {
          "Node Type": "Expression",
          "Description": "Project names",
          "Plans": [
            {
              "Node Type": "ReadFromMergeTree",
              "Description": "Read from default.actors",
              "Indexes": [
                { "Type": "PrimaryKey", "Initial Granules": 100, "Selected Granules": 80 }
              ]
            }
          ]
        }
      }
    ],
    "estimate": [
      { "database": "default", "table": "actors", "parts": 1, "rows": 1000, "marks": 100 }
    ],
    "pipeline": "ExpressionTransform → MergeTreeSelect"
  },
  "settings": { "changed": [] },
  "redaction": {
    "applied": ["string_literals", "numeric_literals"],
    "identifiers": false,
    "summary": "0 string literals, 1 numeric literal replaced"
  }
}
